id,office_name,office_address
331007,岡山市,岡山市北区大供1-1-1
331015,岡山市北区,岡山市北区大供1-1-1
331023,岡山市中区,岡山市中区浜3-7-15
331031,岡山市東区,岡山市東区西大寺南1-2-4
331040,岡山市南区,岡山市南区浦安南町495-5
332020,倉敷市,倉敷市西中新田640
332038,津山市,津山市山北520
332046,玉野市,玉野市宇野1-27-1
332054,笠岡市,笠岡市中央町1-1
332071,井原市,井原市井原町311-1
332089,総社市,総社市中央1-1-1
332097,高梁市,高梁市松原通2043
332101,新見市,新見市新見310-3
332119,備前市,備前市東片上126
332127,瀬戸内市,瀬戸内市邑久町尾張300-1
332135,赤磐市,赤磐市下市344
332143,真庭市,真庭市久世2927-2
332151,美作市,美作市栄町38-2
332160,浅口市,浅口市鴨方町六条院中3050
333468,和気町,和気郡和気町尺所555
334235,早島町,都窪郡早島町大字前潟360-1
334456,里庄町,浅口郡里庄町大字里見1107-2
334618,矢掛町,小田郡矢掛町矢掛3018
335860,新庄村,真庭郡新庄村2008-1
336068,鏡野町,苫田郡鏡野町竹田660
336220,勝央町,勝田郡勝央町勝間田201
336238,奈義町,勝田郡奈義町豊沢306-1
336432,西粟倉村,英田郡西粟倉村大字影石2
336637,久米南町,久米郡久米南町下弓削502-1
336661,美咲町,久米郡美咲町原田1735
336815,吉備中央町,加賀郡吉備中央町豊野1-2